protein_group	eggnog_annot	diamond_annot	annotation	eggnog_proteins_annot	diamond_proteins_annot	organism_eggnog	organism_diamond	go_annotation	upd_full_annot
TRINITY_DN9887_c0_g1_i3.p1_Eve;NODE_10005_length_2959_cov_1108.517869_g6099_i0.p1_Eve	*	PREDICTED: oplophorus-luciferin 2-monooxygenase non-catalytic subunit-like	PREDICTED: oplophorus-luciferin 2-monooxygenase non-catalytic subunit-like		PREDICTED: oplophorus-luciferin 2-monooxygenase non-catalytic subunit-like:2		Arthropoda	*	PREDICTED: oplophorus-luciferin 2-monooxygenase non-catalytic subunit-like
NODE_2991_length_4903_cov_94.584054_g1781_i0.p1_Eve;NODE_1001_length_7004_cov_126.537743_g620_i0.p1_Ecy;NODE_2679_length_4743_cov_121.044951_g1734_i0.p1_Gla;TRINITY_DN3587_c0_g1_i10.p1_Gla;TRINITY_DN361_c19_g1_i1.p1_Eve	*	Sec23/Sec24 helical domain	Sec23/Sec24 helical domain		Sec23/Sec24 helical domain:3;Protein transport protein Sec23A:2		Arthropoda	Sec23A	Sec23A
NODE_10010_length_2958_cov_345.625301_g4963_i1.p1_Eve;NODE_31403_length_1499_cov_589.685517_g5926_i1.p1_Ecy;NODE_33796_length_1416_cov_487.012436_g5926_i2.p1_Ecy;NODE_29960_length_1740_cov_495.026611_g2836_i5.p1_Gla	*	PREDICTED: sucrase-isomaltase, intestinal-like isoform X1	PREDICTED: sucrase-isomaltase, intestinal-like isoform X1		PREDICTED: sucrase-isomaltase, intestinal-like isoform X1:4		Arthropoda	SI	SI
TRINITY_DN41795_c0_g1_i2.p1_Ecy;TRINITY_DN41795_c0_g1_i4.p1_Ecy;TRINITY_DN16531_c0_g1_i3.p1_Eve;NODE_13435_length_2558_cov_71.005580_g2631_i5.p1_Eve;NODE_10026_length_3050_cov_22.511496_g5895_i0.p1_Ecy;NODE_78261_length_849_cov_25.857500_g58868_i0.p1_Eve;TRINITY_DN16531_c0_g1_i1.p1_Eve;NODE_11953_length_2722_cov_18.511785_g8029_i0.p1_Gla;TRINITY_DN12168_c0_g2_i2.p1_Gla	MEP1B	PREDICTED: zinc metalloproteinase nas-15-like, partial	MEP1B	MEP1B:2	PREDICTED: zinc metalloproteinase nas-15-like, partial:5;zinc metalloproteinase nas-4-like isoform X1:1;Peptidase M12A:3	Insecta	Arthropoda	MEP1B	MEP1B
TRINITY_DN1507_c1_g1_i1.p1_Eve;NODE_10037_length_3047_cov_776.104069_g2574_i3.p1_Ecy;TRINITY_DN212_c0_g1_i2.p1_Gla;TRINITY_DN385975_c0_g1_i1.p1_Gla	*	V-type proton ATPase subunit D-like	V-type proton ATPase subunit D-like		V-type proton ATPase subunit D-like:2;ATPase V1 complex subunit D:1;V-type proton ATPase subunit D:1		Arthropoda;Brachiopoda	ATP6V0D1	ATP6V0D1
TRINITY_DN3725_c1_g1_i1.p1_Eve;NODE_10059_length_2953_cov_46.277893_g5221_i1.p1_Eve;TRINITY_DN640_c5_g1_i3.p1_Ecy;TRINITY_DN122935_c0_g1_i3.p1_Gla;TRINITY_DN100545_c0_g2_i1.p1_Gla	*	PREDICTED: arylsulfatase B-like isoform X1	PREDICTED: arylsulfatase B-like isoform X1		PREDICTED: arylsulfatase B-like isoform X1:3;Sulfatase N-terminal:1;PREDICTED: arylsulfatase B-like isoform X2:1		Arthropoda	ARSB	ARSB
TRINITY_DN210860_c0_g1_i12.p1_Gla;NODE_100625_length_763_cov_37.794118_g81092_i0.p1_Gla;TRINITY_DN210860_c0_g1_i8.p1_Gla	rap-1	Ras family protein	rap-1	RAP1A:1;rap-1:2	Ras family protein:1;PREDICTED: ras-related protein Rap-1b-like:1;ras-related protein Rap-1b-like:1	Actinopterygii;Chordata	Chordata;Nematoda	rap-1	rap-1
TRINITY_DN606_c1_g1_i10.p1_Ecy;NODE_10068_length_3041_cov_162.558155_g2352_i4.p1_Ecy;TRINITY_DN19060_c0_g1_i7.p1_Eve;NODE_4518_length_4202_cov_85.858175_g2699_i0.p1_Eve;TRINITY_DN27967_c0_g1_i10.p1_Gla;NODE_3528_length_4341_cov_133.585974_g2271_i0.p1_Gla	PLOD1	PREDICTED: procollagen-lysine,2-oxoglutarate 5-dioxygenase 1-like isoform X4	PLOD1	PLOD1:1	PREDICTED: procollagen-lysine,2-oxoglutarate 5-dioxygenase 1-like isoform X4:4;PREDICTED: procollagen-lysine,2-oxoglutarate 5-dioxygenase 1-like isoform X1:1;Oxoglutarate/iron-dependent dioxygenase:1	Insecta	Arthropoda	PLOD1	PLOD1
NODE_100936_length_699_cov_11987.683077_g29452_i1.p1_Eve;NODE_78071_length_689_cov_11091.246875_g56226_i0.p1_Ecy;NODE_14156_length_2522_cov_3693.903761_g9483_i1.p1_Gla	RPL18A	50S ribosomal protein L18Ae/60S ribosomal protein L20 and L18a	RPL18A	RPL18A:3	50S ribosomal protein L18Ae/60S ribosomal protein L20 and L18a:3	Metazoa	Arthropoda	RPL18A	RPL18A
TRINITY_DN1864_c0_g1_i33.p1_Eve;TRINITY_DN4935_c0_g1_i2.p1_Gla;TRINITY_DN1864_c0_g1_i42.p1_Eve;NODE_9116_length_3197_cov_49.577192_g5355_i0.p2_Ecy;NODE_10099_length_3036_cov_59.928356_g5355_i1.p1_Ecy;TRINITY_DN408_c0_g4_i1.p1_Gla;TRINITY_DN40652_c0_g1_i6.p1_Gla;NODE_22404_length_2024_cov_23.333671_g15650_i0.p1_Gla	goa-1	GTP binding protein alpha subunit Go	goa-1	goa-1:2;GNAO1:1	GTP binding protein alpha subunit Go:3;Guanine nucleotide binding protein (G-protein) alpha subunit:2;Guanine nucleotide-binding G(o) subunit alpha, partial:1;G alpha o subunit isoform X1:2	Chiroptera;Rhabditida	Rotifera;Arthropoda	goa-1	goa-1
NODE_10114_length_2944_cov_11444.185838_g4667_i1.p1_Eve;TRINITY_DN25900_c0_g1_i4.p1_Eve;TRINITY_DN8729_c0_g1_i4.p1_Gla;TRINITY_DN8729_c0_g1_i1.p1_Gla	*	PREDICTED: hemocyanin B chain-like	PREDICTED: hemocyanin B chain-like		Hemocyanin C-terminal, partial:1;PREDICTED: hemocyanin B chain-like:3		Arthropoda	HCB	HCB
NODE_10134_length_2942_cov_218.915313_g6180_i0.p1_Eve;NODE_18055_length_2199_cov_146.785581_g10689_i0.p1_Ecy;TRINITY_DN30332_c0_g1_i8.p1_Gla	*	Transferrin receptor-like dimerization domain	Transferrin receptor-like dimerization domain		Transferrin receptor-like dimerization domain:2;PREDICTED: N-acetylated-alpha-linked acidic dipeptidase 2-like:1		Arthropoda	*	Transferrin receptor-like dimerization domain
NODE_10137_length_3030_cov_1051.626300_g5737_i1.p1_Ecy;NODE_9765_length_3093_cov_1007.982589_g5737_i0.p1_Ecy;NODE_25482_length_1748_cov_286.558564_g5737_i3.p1_Ecy;TRINITY_DN6129_c0_g1_i6.p1_Gla;TRINITY_DN6129_c0_g1_i2.p1_Gla;TRINITY_DN6129_c0_g1_i5.p1_Gla	SERPINB1	PREDICTED: leukocyte elastase inhibitor-like isoform X1	SERPINB1	SERPINB1:6	Serpin domain:1;PREDICTED: leukocyte elastase inhibitor-like isoform X1:3;PREDICTED: leukocyte elastase inhibitor-like isoform X4:1;PREDICTED: leukocyte elastase inhibitor-like isoform X3:1	Vertebrata	Arthropoda	SERPINB1	SERPINB1
NODE_6912_length_3643_cov_249.043406_g4052_i0.p1_Ecy;NODE_5502_length_3878_cov_234.868373_g3288_i0.p1_Eve;NODE_10177_length_2915_cov_136.541172_g6809_i0.p1_Gla;TRINITY_DN27387_c0_g1_i3.p1_Gla;NODE_29757_length_1746_cov_713.753683_g6809_i1.p1_Gla;NODE_8047_length_3383_cov_179.941512_g4052_i1.p1_Ecy	UBXN1	PREDICTED: UBX domain-containing protein 1-like isoform X1	UBXN1	UBXN1:1	PREDICTED: UBX domain-containing protein 1-like isoform X1:5;PREDICTED: UBX domain-containing protein 1-B-like isoform X2:1	Vertebrata	Arthropoda	UBXN1	UBXN1
NODE_101962_length_755_cov_7.694051_g82313_i0.p1_Gla	*	PREDICTED: oplophorus-luciferin 2-monooxygenase non-catalytic subunit-like	PREDICTED: oplophorus-luciferin 2-monooxygenase non-catalytic subunit-like		PREDICTED: oplophorus-luciferin 2-monooxygenase non-catalytic subunit-like:1		Arthropoda	*	PREDICTED: oplophorus-luciferin 2-monooxygenase non-catalytic subunit-like
TRINITY_DN47603_c0_g1_i3.p1_Eve;TRINITY_DN14717_c0_g1_i7.p1_Ecy;NODE_10214_length_3020_cov_92.984517_g5299_i1.p1_Ecy;TRINITY_DN9083_c0_g1_i1.p1_Gla	Nmt	PREDICTED: glycylpeptide N-tetradecanoyltransferase-like	Nmt	Nmt:3;NMT1:1	PREDICTED: glycylpeptide N-tetradecanoyltransferase-like:3;Myristoyl-CoA:protein N-myristoyltransferase N-terminal:1	Nematocera	Arthropoda	Nmt	Nmt
NODE_10220_length_3019_cov_647.210774_g576_i41.p1_Ecy;TRINITY_DN560_c0_g1_i10.p1_Gla;NODE_8034_length_3213_cov_543.688369_g5312_i0.p1_Gla	*	mitochondrial lactate dehydrogenase A chain	mitochondrial lactate dehydrogenase A chain		mitochondrial lactate dehydrogenase A chain:3		Arthropoda	CYB2	CYB2
TRINITY_DN25015_c0_g2_i2.p1_Eve;NODE_13764_length_2526_cov_38.679451_g8489_i0.p1_Eve;TRINITY_DN7972_c0_g1_i2.p1_Ecy;NODE_10244_length_3016_cov_81.669363_g6021_i0.p1_Ecy	*	glutathione hydrolase 1 proenzyme-like isoform X1	glutathione hydrolase 1 proenzyme-like isoform X1		glutathione hydrolase 1 proenzyme-like isoform X1:4		Arthropoda	GGT1	GGT1
NODE_10604_length_2961_cov_65.856799_g6062_i1.p1_Ecy;NODE_10313_length_3006_cov_69.799459_g6062_i0.p1_Ecy;TRINITY_DN1011_c0_g1_i13.p1_Eve;TRINITY_DN121897_c0_g1_i1.p1_Gla;NODE_23417_length_1853_cov_2250.276053_g14008_i0.p1_Ecy	*	Membrane attack complex component/perforin (MACPF) domain	Membrane attack complex component/perforin (MACPF) domain		Membrane attack complex component/perforin (MACPF) domain:2;kelch-like protein 20:1;Kelch-like protein 3:1		Arthropoda;Cnidaria	*	Membrane attack complex component/perforin (MACPF) domain
NODE_103329_length_746_cov_443.625538_g83575_i0.p1_Gla	*	hemocyanin subunit 1	hemocyanin subunit 1		hemocyanin subunit 1:1		Arthropoda	KLH1	KLH1
NODE_14150_length_2491_cov_14.114660_g8733_i0.p1_Eve;NODE_10337_length_3003_cov_121.674678_g6074_i0.p1_Ecy;TRINITY_DN342_c0_g3_i1.p1_Ecy;TRINITY_DN27879_c1_g1_i2.p1_Eve;NODE_2254_length_4994_cov_167.151668_g1465_i0.p1_Gla;TRINITY_DN3144_c0_g1_i2.p1_Gla	SI	Galactose mutarotase N-terminal barrel	SI	SI:1;MGAM:1	Galactose mutarotase N-terminal barrel:3;PREDICTED: sucrase-isomaltase, intestinal-like isoform X1:1;maltase-glucoamylase, intestinal-like:1;PREDICTED: sucrase-isomaltase, intestinal-like:1	Arthropoda;Carnivora	Arthropoda	SI	SI
TRINITY_DN5545_c0_g1_i5.p1_Eve;NODE_779_length_7133_cov_212.099238_g473_i0.p1_Eve;NODE_1037_length_6229_cov_176.319417_g689_i0.p1_Gla;NODE_1464_length_6309_cov_459.695687_g908_i0.p1_Ecy	Myo1A	PREDICTED: myosin-IA-like	Myo1A	Myo1A:4	PREDICTED: myosin-IA-like:4	Insecta	Arthropoda	Myo1A	Myo1A
NODE_1038_length_6928_cov_156.934293_g640_i0.p1_Ecy;TRINITY_DN584_c0_g1_i1.p1_Eve;NODE_5180_length_3982_cov_144.345029_g1312_i2.p1_Eve;NODE_632_length_7132_cov_81.366370_g415_i0.p1_Gla	P58IPK	PREDICTED: dnaJ homolog subfamily C member 3-like	P58IPK	P58IPK:4	PREDICTED: dnaJ homolog subfamily C member 3-like:3;Tetratricopeptide repeat:1	Insecta	Arthropoda	P58IPK	P58IPK
NODE_392_length_8280_cov_106.126109_g245_i0.p1_Eve;TRINITY_DN3656_c1_g1_i6.p1_Eve;NODE_38117_length_1409_cov_144.631618_g245_i2.p1_Eve;TRINITY_DN128820_c0_g1_i2.p1_Gla;TRINITY_DN3656_c1_g1_i1.p1_Eve;TRINITY_DN3656_c1_g1_i18.p1_Eve;TRINITY_DN3656_c1_g1_i11.p1_Eve;NODE_3223_length_4913_cov_140.574219_g1880_i1.p1_Ecy;NODE_10438_length_2886_cov_83.124780_g5984_i1.p1_Gla;TRINITY_DN1033_c1_g1_i6.p1_Ecy;TRINITY_DN128820_c0_g1_i31.p1_Gla;TRINITY_DN128820_c0_g1_i34.p1_Gla;TRINITY_DN1033_c1_g1_i21.p1_Ecy;NODE_3105_length_4985_cov_135.120746_g1880_i0.p1_Ecy;TRINITY_DN128820_c0_g1_i9.p1_Gla;NODE_8987_length_3063_cov_76.414731_g5984_i0.p1_Gla	Synd	protein kinase C and casein kinase substrate in neurons protein 1-like	Synd	Synd:14;PACSIN3:2	PREDICTED: protein kinase C and casein kinase II substrate protein 3-like:2;protein kinase C and casein kinase substrate in neurons protein 1-like:10;putative protein kinase C and casein kinase substrate in neurons protein 1:4	Lepidoptera;Hymenoptera	Arthropoda	Synd	Synd
TRINITY_DN519_c0_g1_i6.p1_Eve;NODE_10450_length_2897_cov_1333.864466_g6386_i0.p1_Eve;TRINITY_DN2479_c0_g1_i4.p1_Ecy;TRINITY_DN13425_c0_g1_i11.p1_Gla;TRINITY_DN143794_c0_g1_i1.p1_Gla	Hn	PREDICTED: protein henna-like	Hn	Hn:3;PAH:2	PREDICTED: protein henna-like:4;protein henna-like isoform X2:1	Chordata;Insecta	Arthropoda;Mollusca	Hn	Hn
NODE_104611_length_680_cov_1277.136292_g8670_i3.p1_Eve;NODE_107873_length_719_cov_2191.607463_g12491_i4.p1_Gla;NODE_80932_length_913_cov_2487.266204_g12491_i1.p1_Gla;NODE_86947_length_862_cov_510.249692_g68784_i0.p2_Gla;TRINITY_DN5357_c0_g1_i37.p1_Gla;TRINITY_DN18801_c0_g3_i44.p1_Eve;TRINITY_DN18801_c0_g3_i10.p1_Eve;TRINITY_DN18801_c0_g3_i27.p1_Eve	*	PREDICTED: keratin, type II cytoskeletal 2 epidermal-like	PREDICTED: keratin, type II cytoskeletal 2 epidermal-like		PREDICTED: keratin, type II cytoskeletal 2 epidermal-like:4		Arthropoda	KRT2	KRT2
TRINITY_DN177582_c0_g1_i6.p1_Eve;NODE_10510_length_2888_cov_843.786192_g6422_i0.p1_Eve;NODE_39908_length_1241_cov_1759.886745_g1965_i33.p1_Ecy	FK506-bp1	PREDICTED: 46 kDa FK506-binding nuclear protein-like isoform X1	FK506-bp1	FK506-bp1:1	PREDICTED: 46 kDa FK506-binding nuclear protein-like isoform X1:1;PREDICTED: 46 kDa FK506-binding nuclear protein-like isoform X2:1;FKBP-type peptidyl-prolyl cis-trans isomerase domain:1	Lepidoptera	Arthropoda	FK506-bp1	FK506-bp1
NODE_22094_length_2039_cov_15.957286_g15407_i0.p1_Gla;TRINITY_DN143056_c0_g1_i4.p1_Ecy;TRINITY_DN266246_c0_g1_i4.p1_Eve;NODE_10525_length_2975_cov_19.350991_g6191_i0.p1_Ecy;TRINITY_DN311407_c0_g1_i2.p1_Gla;NODE_16128_length_2327_cov_18.112818_g5277_i1.p1_Eve	RASA1	Pleckstrin domain	RASA1	RASA1:1	Pleckstrin domain:3;PREDICTED: ras GTPase-activating protein 1-like:3	Insecta	Arthropoda	RASA1	RASA1
TRINITY_DN366_c0_g1_i12.p1_Gla;NODE_10531_length_2876_cov_355.253626_g7047_i0.p1_Gla	rnh1	PREDICTED: ribonuclease H1-like	rnh1	rnh1:2	PREDICTED: ribonuclease H1-like:1;Ribonuclease H1 N-terminal:1	Hymenoptera	Arthropoda	rnh1	rnh1
NODE_10549_length_2882_cov_925.379456_g6444_i0.p1_Eve;TRINITY_DN2143_c0_g1_i2.p1_Eve;TRINITY_DN216120_c0_g1_i11.p1_Gla;NODE_75223_length_875_cov_789.150121_g56186_i0.p1_Eve	*	PREDICTED: protein transport protein SEC31-like	PREDICTED: protein transport protein SEC31-like		PREDICTED: protein transport protein SEC31-like:4		Arthropoda	SEC31	SEC31
NODE_10579_length_2879_cov_89.725088_g6462_i0.p1_Eve;TRINITY_DN16061_c0_g2_i2.p1_Eve;TRINITY_DN9911_c1_g1_i2.p1_Ecy;TRINITY_DN82066_c0_g1_i1.p1_Gla	DBLOX	PREDICTED: chorion peroxidase-like	DBLOX	DBLOX:4	PREDICTED: chorion peroxidase-like:1;peroxidasin homolog:1	Paraneoptera	Arthropoda	DBLOX	DBLOX
NODE_10584_length_2879_cov_42.140636_g6465_i0.p1_Eve;TRINITY_DN34_c0_g1_i4.p1_Eve;TRINITY_DN16056_c0_g1_i1.p1_Ecy	*	PREDICTED: sucrase-isomaltase, intestinal-like	PREDICTED: sucrase-isomaltase, intestinal-like		Glycoside hydrolase family 31, partial:1;PREDICTED: sucrase-isomaltase, intestinal-like:2		Arthropoda	SI	SI
NODE_10606_length_2876_cov_4465.780686_g6253_i1.p1_Eve;TRINITY_DN7019_c1_g1_i1.p1_Eve;NODE_10869_length_2920_cov_4970.377917_g5478_i1.p1_Ecy;TRINITY_DN13891_c0_g1_i4.p1_Gla;NODE_22442_length_1942_cov_11.255151_g14284_i0.p1_Eve;TRINITY_DN52703_c0_g2_i1.p1_Eve	Hsc70-3	Heat shock protein 70 family	Hsc70-3	Hsc70-3:4;HSPA5:2	Heat shock protein 70 family:2;PREDICTED: LOW QUALITY PROTEIN: heat shock 70 kDa protein cognate 3-like:2	Bilateria;Drosophilidae;Hymenoptera	Arthropoda	Hsc70-3	Hsc70-3
NODE_4198_length_4314_cov_75.632122_g2508_i0.p1_Eve;NODE_10633_length_2956_cov_51.771586_g6252_i0.p1_Ecy;TRINITY_DN5748_c0_g1_i5.p1_Ecy;TRINITY_DN981_c1_g1_i1.p1_Eve;NODE_38918_length_1267_cov_63.582923_g6252_i1.p1_Ecy;NODE_5423_length_3738_cov_33.327189_g3538_i0.p1_Gla;NODE_47757_length_1211_cov_41.566265_g2508_i1.p1_Eve;TRINITY_DN18197_c0_g1_i2.p1_Gla	CPT2	PREDICTED: carnitine O-palmitoyltransferase 2, mitochondrial-like	CPT2	CPT2:4	Acyltransferase ChoActase/COT/CPT:3;PREDICTED: carnitine O-palmitoyltransferase 2, mitochondrial-like:5	Actinopterygii;Arthropoda	Arthropoda	CPT2	CPT2
TRINITY_DN509_c0_g1_i30.p1_Eve;NODE_10642_length_2872_cov_182.234148_g6507_i0.p1_Eve	*	PREDICTED: prestalk protein-like isoform X3	PREDICTED: prestalk protein-like isoform X3		PREDICTED: prestalk protein-like isoform X3:1;Chitin binding domain:1		Arthropoda	ecmB	ecmB
TRINITY_DN10112_c0_g1_i3.p1_Eve;NODE_10648_length_2871_cov_568.610560_g6512_i0.p1_Eve;TRINITY_DN60953_c0_g1_i3.p1_Ecy;TRINITY_DN40999_c0_g1_i1.p1_Gla;CON__Q3ZBD7	GPI	PREDICTED: glucose-6-phosphate isomerase-like	GPI	GPI:2	PREDICTED: glucose-6-phosphate isomerase-like:2;Phosphoglucose isomerase (PGI):1;glucose-6-phosphate isomerase:1	Metatheria;Insecta	Arthropoda;Chordata	GPI	GPI
NODE_10670_length_2867_cov_726.975160_g6528_i0.p1_Eve;TRINITY_DN1237_c0_g1_i16.p1_Eve	*	PREDICTED: uncharacterized protein LOC108669456	PREDICTED: uncharacterized protein LOC108669456		PREDICTED: uncharacterized protein LOC108669456:2		Arthropoda	*	PREDICTED: uncharacterized protein LOC108669456
NODE_16497_length_2300_cov_422.369169_g6529_i1.p1_Eve;NODE_10671_length_2867_cov_222.735628_g6529_i0.p1_Eve;TRINITY_DN3637_c1_g1_i4.p1_Eve;NODE_16617_length_2308_cov_28.175299_g9312_i1.p1_Ecy;TRINITY_DN39561_c0_g1_i26.p1_Ecy;NODE_15800_length_2375_cov_27.402408_g9312_i0.p1_Ecy;TRINITY_DN8893_c1_g1_i1.p1_Gla;TRINITY_DN8893_c0_g1_i9.p1_Gla	*	AMP-binding enzyme C-terminal domain	AMP-binding enzyme C-terminal domain		AMP-binding enzyme C-terminal domain:4;4-coumarate--CoA ligase-like:1;4-coumarate--CoA ligase-like isoform X2:1;PREDICTED: 4-coumarate--CoA ligase-like 4:1;probable 4-coumarate--CoA ligase 1:1		Arthropoda	*	AMP-binding enzyme C-terminal domain
TRINITY_DN6627_c0_g1_i2.p1_Eve;TRINITY_DN4785_c0_g1_i3.p1_Ecy;NODE_10733_length_2861_cov_99.163229_g6564_i0.p1_Eve;NODE_42876_length_1170_cov_93.388938_g7787_i1.p1_Ecy;NODE_16642_length_2343_cov_104.126853_g11373_i0.p1_Gla	FARSB	PREDICTED: phenylalanine--tRNA ligase beta subunit-like	FARSB	FARSB:4	PREDICTED: phenylalanine--tRNA ligase beta subunit-like:5	Actinopterygii;Metazoa	Arthropoda	FARSB	FARSB
TRINITY_DN298_c1_g1_i5.p1_Gla;NODE_10778_length_2933_cov_963.312067_g6331_i0.p1_Ecy	*	PREDICTED: tubulin beta chain-like	PREDICTED: tubulin beta chain-like		PREDICTED: tubulin beta chain-like:2		Arthropoda	TUBB	TUBB
NODE_1082_length_6568_cov_124.213683_g339_i1.p1_Eve;TRINITY_DN84526_c0_g1_i1.p1_Ecy;NODE_16783_length_2294_cov_109.571047_g9923_i0.p1_Ecy;NODE_53028_length_977_cov_100.546336_g9923_i2.p1_Ecy;TRINITY_DN22125_c0_g1_i3.p1_Gla;NODE_17651_length_2277_cov_60.498654_g12106_i0.p1_Gla;NODE_47128_length_1083_cov_45.838491_g9923_i1.p1_Ecy	Gal	PREDICTED: beta-galactosidase-like	Gal	Gal:1	PREDICTED: beta-galactosidase-like:7	Arthropoda	Arthropoda	Gal	Gal
NODE_1114_length_6807_cov_43.852767_g664_i1.p1_Ecy;NODE_1082_length_6858_cov_43.567778_g664_i0.p1_Ecy;TRINITY_DN16617_c0_g1_i4.p1_Gla;NODE_94632_length_804_cov_24.845033_g75626_i0.p1_Gla;NODE_35565_length_1582_cov_6.748858_g24136_i1.p1_Gla;TRINITY_DN40537_c0_g1_i1.p1_Gla;TRINITY_DN40537_c0_g1_i4.p1_Gla;TRINITY_DN42645_c0_g1_i9.p1_Eve;TRINITY_DN42645_c0_g1_i5.p1_Eve	LanB1	PREDICTED: laminin subunit beta-1-like isoform X3	LanB1	LanB1:9	PREDICTED: laminin subunit beta-1-like isoform X3:2;PREDICTED: laminin subunit beta-1-like isoform X1:1;PREDICTED: laminin subunit beta-1-like isoform X6:2;Laminin EGF domain, partial:1;PREDICTED: laminin subunit beta-1-like isoform X5:2;PREDICTED: laminin subunit beta-1-like isoform X4:1	Insecta;Arthropoda;Diptera	Arthropoda	LanB1	LanB1
NODE_10829_length_2926_cov_936.536670_g5226_i1.p1_Ecy;NODE_8329_length_3229_cov_401.575472_g5032_i0.p1_Eve;NODE_11108_length_2812_cov_345.781035_g7432_i0.p1_Gla	*	Phytanoyl-CoA dioxygenase	Phytanoyl-CoA dioxygenase		Phytanoyl-CoA dioxygenase:3		Arthropoda	PHYH	PHYH
NODE_1084_length_6567_cov_85.409942_g666_i0.p1_Eve;TRINITY_DN27623_c1_g1_i5.p1_Eve;NODE_16317_length_2333_cov_50.776270_g9623_i0.p1_Ecy;TRINITY_DN13435_c0_g1_i2.p1_Ecy;TRINITY_DN6281_c0_g1_i7.p1_Gla;NODE_11689_length_2749_cov_88.365926_g7837_i0.p1_Gla	CECR1	PREDICTED: adenosine deaminase CECR1-like	CECR1	CECR1:1	PREDICTED: adenosine deaminase CECR1-like:6	Arthropoda	Arthropoda	CECR1	CECR1
TRINITY_DN240_c0_g1_i34.p1_Eve;NODE_7030_length_3488_cov_604.436464_g4226_i0.p1_Eve;TRINITY_DN240_c0_g1_i33.p1_Eve;NODE_10849_length_2848_cov_225.667738_g4226_i1.p1_Eve;TRINITY_DN240_c0_g1_i27.p1_Eve;TRINITY_DN240_c0_g1_i20.p1_Eve;TRINITY_DN240_c0_g1_i50.p1_Eve;TRINITY_DN240_c0_g1_i16.p1_Eve;NODE_5682_length_3964_cov_416.234483_g3246_i1.p1_Ecy;NODE_5535_length_4006_cov_408.293151_g3246_i0.p1_Ecy;NODE_9089_length_3201_cov_630.042195_g3246_i2.p1_Ecy;TRINITY_DN56_c0_g1_i29.p1_Ecy;TRINITY_DN56_c0_g1_i32.p1_Ecy;NODE_7726_length_3262_cov_336.957049_g5101_i0.p1_Gla;NODE_16302_length_2364_cov_136.031533_g5101_i1.p1_Gla;TRINITY_DN13145_c0_g1_i10.p1_Gla;TRINITY_DN13145_c0_g1_i21.p1_Gla	*	intracellular protein transport protein USO1-like	intracellular protein transport protein USO1-like		intracellular protein transport protein USO1-like:6;PREDICTED: kinectin-like, partial:2;putative ribosome-binding protein 1 isoform X4, partial:2		Arthropoda	USO1	USO1
NODE_1088_length_6565_cov_82.685850_g668_i0.p1_Eve;TRINITY_DN10872_c0_g1_i4.p1_Eve;NODE_1814_length_5930_cov_117.494304_g1120_i0.p1_Ecy;TRINITY_DN47872_c0_g1_i1.p1_Ecy;NODE_36196_length_1342_cov_10.178654_g22367_i0.p1_Ecy;TRINITY_DN32900_c0_g1_i1.p1_Eve;NODE_29142_length_1663_cov_12.254647_g18953_i0.p1_Eve	*	PREDICTED: xanthine dehydrogenase 1-like	PREDICTED: xanthine dehydrogenase 1-like		PREDICTED: xanthine dehydrogenase 1-like:3;Aldehyde oxidase/xanthine dehydrogenase molybdopterin binding:2;PREDICTED: xanthine dehydrogenase 2-like:1		Arthropoda	XDH	XDH
NODE_1092_length_6845_cov_236.132137_g671_i0.p1_Ecy;TRINITY_DN1822_c0_g1_i1.p1_Eve;NODE_935_length_6809_cov_179.398077_g572_i0.p1_Eve;TRINITY_DN1822_c0_g1_i2.p1_Eve;NODE_2115_length_5084_cov_115.974181_g1378_i0.p1_Gla;TRINITY_DN2168_c0_g1_i3.p1_Gla	vib	PREDICTED: phosphatidylinositol transfer protein alpha isoform-like	vib	vib:6	PREDICTED: phosphatidylinositol transfer protein alpha isoform-like:6	Diptera	Arthropoda	vib	vib
NODE_109243_length_658_cov_1893.121511_g87089_i0.p1_Eve	*	CUB domain	CUB domain		CUB domain:1		Arthropoda	*	CUB domain
TRINITY_DN3260_c0_g1_i10.p1_Eve;NODE_1093_length_6553_cov_1901.675277_g670_i0.p1_Eve;TRINITY_DN291388_c0_g3_i5.p1_Ecy;TRINITY_DN10202_c0_g1_i10.p1_Gla;NODE_10136_length_3030_cov_1746.517276_g761_i1.p1_Ecy;NODE_6316_length_3532_cov_546.333046_g573_i1.p1_Gla	HDLBP	PREDICTED: vigilin-like	HDLBP	HDLBP:1	PREDICTED: vigilin-like:3;K domain type 1:3	Insecta	Arthropoda	HDLBP	HDLBP
TRINITY_DN5460_c1_g3_i2.p1_Eve;TRINITY_DN5774_c11_g1_i2.p1_Ecy;NODE_1094_length_6553_cov_165.139145_g671_i0.p1_Eve;NODE_3762_length_4658_cov_91.006943_g1988_i1.p1_Ecy;NODE_3557_length_4334_cov_164.131622_g2293_i0.p1_Gla;TRINITY_DN6910_c0_g1_i3.p1_Gla	Dmn	PREDICTED: dynactin subunit 2-like	Dmn	Dmn:5;DCTN2:1	PREDICTED: dynactin subunit 2-like:6	Insecta	Arthropoda	Dmn	Dmn
TRINITY_DN20560_c0_g2_i10.p1_Eve;NODE_1099_length_6548_cov_645.809048_g674_i0.p1_Eve;TRINITY_DN8847_c0_g1_i10.p1_Ecy;TRINITY_DN4259_c0_g1_i7.p1_Gla;NODE_1467_length_5659_cov_333.074332_g972_i0.p1_Gla	*	PREDICTED: mucin-19-like isoform X2	PREDICTED: mucin-19-like isoform X2		PREDICTED: mucin-19-like isoform X2:3		Arthropoda	MUC19	MUC19
NODE_10995_length_2901_cov_250.791725_g6456_i0.p1_Ecy	FAM172A	protein FAM172A	FAM172A	FAM172A:1	protein FAM172A:1	Bilateria	Arthropoda	FAM172A	FAM172A
TRINITY_DN547_c0_g1_i19.p1_Eve;NODE_14_length_15246_cov_144.353754_g8_i1.p1_Eve;TRINITY_DN547_c0_g1_i23.p1_Eve;TRINITY_DN547_c0_g1_i37.p1_Eve;NODE_11_length_15666_cov_143.069283_g8_i0.p1_Eve;NODE_26_length_15798_cov_139.254238_g12_i1.p1_Ecy;NODE_20_length_16218_cov_137.806791_g12_i0.p1_Ecy;TRINITY_DN11113_c0_g1_i4.p1_Gla;NODE_5_length_16704_cov_87.299490_g4_i0.p1_Gla;NODE_5_length_16704_cov_87.299490_g4_i0.p2_Gla	kst	PREDICTED: spectrin beta chain, non-erythrocytic 1-like	kst	kst:10	PREDICTED: spectrin beta chain, non-erythrocytic 1-like:9;Spectrin repeat:1	Hymenoptera	Arthropoda	kst	kst
TRINITY_DN18913_c0_g1_i8.p1_Eve;NODE_11018_length_2898_cov_1104.644437_g6468_i0.p1_Ecy;TRINITY_DN9052_c0_g1_i3.p1_Gla;NODE_66391_length_798_cov_1248.610147_g6468_i6.p1_Ecy;NODE_101283_length_759_cov_8.039437_g81691_i0.p1_Gla;TRINITY_DN18913_c0_g1_i1.p1_Eve;TRINITY_DN45836_c0_g2_i1.p1_Gla	Elf	PREDICTED: eukaryotic peptide chain release factor GTP-binding subunit ERF3A-like	Elf	Elf:5	PREDICTED: eukaryotic peptide chain release factor GTP-binding subunit ERF3A-like:5;eukaryotic peptide chain release factor GTP-binding subunit ERF3A isoform X3:1;eukaryotic peptide chain release factor GTP-binding subunit ERF3A:1	Arthropoda;Insecta	Rotifera;Arthropoda	Elf	Elf
TRINITY_DN6404_c0_g1_i11.p1_Eve;NODE_21241_length_2004_cov_88.845013_g13477_i0.p1_Eve;NODE_11031_length_2897_cov_137.857444_g5871_i1.p1_Ecy;TRINITY_DN59547_c0_g1_i3.p1_Gla;NODE_31858_length_1683_cov_29.598531_g22804_i0.p1_Gla	*	zinc metalloproteinase nas-4-like isoform X1	zinc metalloproteinase nas-4-like isoform X1		zinc metalloproteinase nas-4-like isoform X1:5		Arthropoda	nas-4	nas-4
NODE_11055_length_2821_cov_86.046898_g6771_i0.p1_Eve;NODE_69275_length_1028_cov_34.728294_g53317_i0.p1_Gla;TRINITY_DN67871_c0_g2_i2.p1_Gla;TRINITY_DN3841_c0_g1_i2.p1_Ecy	*	PREDICTED: oplophorus-luciferin 2-monooxygenase non-catalytic subunit-like	PREDICTED: oplophorus-luciferin 2-monooxygenase non-catalytic subunit-like		PREDICTED: oplophorus-luciferin 2-monooxygenase non-catalytic subunit-like:4		Arthropoda	*	PREDICTED: oplophorus-luciferin 2-monooxygenase non-catalytic subunit-like
NODE_2193_length_5581_cov_49.327549_g1359_i0.p1_Ecy;TRINITY_DN3100_c0_g1_i2.p1_Eve;NODE_1106_length_6543_cov_76.194179_g677_i0.p1_Eve;NODE_3764_length_4656_cov_55.629260_g1359_i1.p2_Ecy;NODE_3764_length_4656_cov_55.629260_g1359_i1.p1_Ecy	*	PREDICTED: dual oxidase 2-like	PREDICTED: dual oxidase 2-like		PREDICTED: dual oxidase 2-like:4		Arthropoda	DUOX2	DUOX2
NODE_6652_length_3568_cov_206.195794_g3986_i0.p1_Eve;TRINITY_DN3124_c1_g1_i8.p1_Ecy;NODE_11064_length_2893_cov_246.937060_g6491_i0.p1_Ecy;TRINITY_DN7996_c0_g1_i8.p1_Eve;TRINITY_DN7996_c0_g1_i11.p1_Eve;TRINITY_DN5690_c0_g1_i5.p1_Gla	*	PREDICTED: uncharacterized protein LOC108677020	PREDICTED: uncharacterized protein LOC108677020		PREDICTED: uncharacterized protein LOC108677020:6		Arthropoda	*	PREDICTED: uncharacterized protein LOC108677020
TRINITY_DN968_c0_g1_i6.p1_Ecy;NODE_11069_length_2819_cov_183.403610_g6779_i0.p1_Eve;NODE_1998_length_5179_cov_187.059064_g1310_i0.p1_Gla;TRINITY_DN17496_c0_g1_i1.p1_Eve	BPNT1	3'(2'),5'-bisphosphate nucleotidase 1-like isoform X2	BPNT1	BPNT1:1	3'(2'),5'-bisphosphate nucleotidase 1-like isoform X2:2;Inositol monophosphatase-like:2	Paraneoptera	Arthropoda	BPNT1	BPNT1
NODE_11126_length_2811_cov_12.748009_g6820_i0.p1_Eve;TRINITY_DN225999_c0_g1_i2.p1_Eve;NODE_1691_length_6047_cov_22.855452_g1041_i0.p1_Ecy;TRINITY_DN118652_c0_g1_i5.p1_Gla;NODE_13381_length_2587_cov_12.232467_g9041_i0.p1_Gla;NODE_14456_length_2500_cov_12.398205_g9041_i1.p1_Gla	*	PREDICTED: rho-associated protein kinase 2-like	PREDICTED: rho-associated protein kinase 2-like		PREDICTED: rho-associated protein kinase 2-like:6		Arthropoda	ROCK2	ROCK2
